file1,start1,end1,file2,start2,end2,classification,notes
10924700_0_1_18.java,1,18,spring-framework-3.0.5/spring-framework-3.0.5.RELEASE/projects/org.springframework.oxm/src/main/java/org/springframework/oxm/jaxb/Jaxb2Marshaller.java,253,270,QS,"question is about springer. Author of answer says the problem faced by the question is caused by the fact its configuration is not activating the following code, then posts code from springer"
11187462_0_44_61.java,1,18,apache-log4j-1.2.16/apache-log4j-1.2.16/contribs/JimMoore/LoggingOutputStream.java,32,48,QS,author of answers says he copied from log4j and adapted a bit
11368428_1_1_27.java,1,27,jfreechart-1/jfreechart-1.0.13/source/org/jfree/chart/demo/BarChartDemo1.java,29,55,QS,"answer mentions JFreeChart, author of answer suggests to use the following SO snippet with the solution he proposed"
11368428_1_1_27.java,1,27,jfreechart-1/jfreechart-1.0.13/swt/org/jfree/experimental/chart/swt/demo/SWTBarChartDemo1.java,19,45,QS,"answer mentions JFreeChart, author of answer suggests to use the following SO snippet with the solution he proposed"
12106623_0_1_16.java,1,16,apache-log4j-1.2.16/apache-log4j-1.2.16/src/main/java/org/apache/log4j/WriterAppender.java,45,61,QS,author copied code from log4j to answer the question
12377779_0_1_37.java,1,37,netbeans-6.9.1-201007282301/kenai.ui/src/org/netbeans/modules/kenai/ui/treelist/TreeList.java,125,159,QS,author copied code from specific class on netbeans to answer the question
12427981_1_17_33.java,1,17,apache-log4j-1.2.16/apache-log4j-1.2.16/contribs/JimMoore/LoggingOutputStream.java,32,48,QS,MOTIVATION author of answer says he's copying and pasting from apache project.
12936580_0_63_197.java,1,135,jfreechart-1/jfreechart-1.0.13/source/org/jfree/chart/renderer/xy/AbstractXYItemRenderer.java,443,578,QS,question is about JFreeChart. author of answer says he combined codes to achieve solution
12936580_0_63_197.java,1,135,jfreechart-1/jfreechart-1.0.13/source/org/jfree/chart/renderer/xy/AbstractXYItemRenderer.java,596,731,QS,question is about JFreeChart. author of answer says he combined codes to achieve solution
13219118_0_12_27.java,1,16,Compiere_330_Source/release_330/ad/src/org/compiere/translate/AmtInWords_EN.java,49,64,QS,SO copied code from web. web copies code from Qualitas. Q to S via web
13219118_0_12_27.java,1,16,Compiere_330_Source/release_330/ad/src/org/compiere/translate/AmtInWords_FR.java,49,69,QS,author of answer says he copied from this link http://www.rgagnon.com/javadetails/java-0426.html. in the qualitas project
13524878_0_1_16.java,1,16,netbeans-6.9.1-201007282301/java.source/test/unit/data/jdk/JTable.java,1469,1484,QS,SO provides code to point to the problem the author of the question had.
14019840_0_1_18.java,1,18,struts2-2.2.1-all/struts-2.2.1/src/core/src/main/java/org/apache/struts2/dispatcher/mapper/DefaultActionMapper.java,128,145,QS,SO provides code from struts to help answering the question
14940863_0_1_26.java,1,26,jstock-1.0.7c/jstock/src/org/yccheok/jstock/alert/GoogleMail.java,18,43,QS,SO says he copied from jstock
15110171_0_23_40.java,1,18,struts2-2.2.1-all/struts-2.2.1/src/xwork-core/src/main/java/com/opensymphony/xwork2/validator/validators/StringLengthFieldValidator.java,25,42,QS,SO says he based on struts code to provide solution
16860613_0_55_74.java,1,20,eclipse_SDK/eclipse_SDK-4.3/src/src/org/eclipse/jface/viewers/StyledString.java,55,74,QS,DELETED FROM SO literal copy from eclipse
16928749_0_50_66.java,1,17,hadoop-1/hadoop-1.0.0/src/mapred/org/apache/hadoop/mapred/TextOutputFormat.java,46,63,QS,SO snippet extends class from Qualitas hadoop. SO question tags hadoop
16928749_0_50_66.java,1,17,hadoop-1/hadoop-1.0.0/src/mapred/org/apache/hadoop/mapreduce/lib/output/TextOutputFormat.java,50,67,QS,SO snippet extends class from Qualitas hadoop. SO question tags hadoop
18137301_0_3_15.java,1,13,antlr4-4.0/tool/test/org/antlr/v4/test/TestPerformance.java,559,570,QS,author of answer says ge copied code from antlr
21702608_0_1_36.java,1,36,hadoop-1/hadoop-1.0.0/src/examples/org/apache/hadoop/examples/DBCountPageView.java,275,306,QS,SO answer copies code from question and adds solution. SO questions copies code from hadoop example
21734562_0_1_70.java,1,70,apache-tomcat-7.0.2/apache-tomcat-7.0.2-src/java/org/apache/catalina/authenticator/BasicAuthenticator.java,23,87,QS,SO answer says he copied from tomcat
21787713_0_1_14.java,1,14,spring-framework-3.0.5/spring-framework-3.0.5.RELEASE/projects/org.springframework.web.servlet/src/main/java/org/springframework/web/servlet/DispatcherServlet.java,119,132,QS,SO gives example from spring to illustrate answer
21998949_0_10_89.java,1,80,jfreechart-1/jfreechart-1.0.13/source/org/jfree/chart/plot/SpiderWebPlot.java,502,578,QS,SO says he copied from jfreechart and altered a bit
22064171_0_56_103.java,1,48,iReport-3/iReport-3.7.5-src/ireport-designer/src/com/jaspersoft/ireport/designer/sheet/editors/box/ShapeStroke.java,23,80,QS,SO says he copied from the web. website is owned by the same developer as ireport.
22230019_0_1_19.java,1,19,eclipse_SDK/eclipse_SDK-4.3/src/src/org/eclipse/swt/widgets/Widget.java,424,442,QS,SO copies code from Eclipse to help in the answer
23520731_0_1_75.java,1,75,hibernate-release-4/hibernate-release-4.2.2.Final/project/hibernate-core/src/main/java/org/hibernate/tool/hbm2ddl/SchemaUpdate.java,115,190,QS,SO copies code from hibernate to help the answer
23967852_0_1_20.java,1,20,hibernate-release-4/hibernate-release-4.2.2.Final/project/hibernate-core/src/main/java/org/hibernate/dialect/pagination/SQLServer2005LimitHandler.java,43,62,QS,SO copies code from hibernate to help the answer
24404964_0_1_36.java,1,36,apache-tomcat-7.0.2/apache-tomcat-7.0.2-src/java/org/apache/catalina/connector/CoyoteAdapter.java,543,578,QS,SO copies from tomcat to help the answer
24924255_0_1_32.java,1,32,hibernate-release-4/hibernate-release-4.2.2.Final/project/hibernate-core/src/main/java/org/hibernate/criterion/Example.java,218,247,QS,stackoverflow answer mentions the code in this link: http://grepcode.com/file/repo1.maven.org/maven2/org.hibernate/hibernate/3.2.7.ga/org/hibernate/criterion/Example.java
25056629_1_1_14.java,1,14,iText-src-5/src/core/com/itextpdf/text/pdf/PdfWriter.java,538,551,QS,question is about iText. Author of answer posts the code from iText that is an example of the shortcome pointed by the question
2513183_0_45_55.java,1,11,eclipse_SDK/eclipse_SDK-4.3/src/src/org/eclipse/jdt/ui/actions/GenerateToStringAction.java,45,55,QS,SO copies code from Eclipse to help answer
2513183_0_106_159.java,1,54,eclipse_SDK/eclipse_SDK-4.3/src/src/org/eclipse/jdt/ui/actions/GenerateToStringAction.java,113,166,QS,author says he copied from eclipse (outdated code)
25719073_1_1_20.java,1,20,eclipse_SDK/eclipse_SDK-4.3/src/src/org/eclipse/swt/widgets/Widget.java,309,328,QS,SO says he copied from eclipse to answer question
3629882_0_1_26.java,1,26,jstock-1.0.7c/jstock/src/org/yccheok/jstock/gui/Utils.java,1484,1502,QS,"author of question copies from jstock, answer edits code to find solution"
3911987_0_38_53.java,1,16,Compiere_330_Source/release_330/ad/src/org/compiere/translate/AmtInWords_EN.java,49,64,QS,known snippet to convert numbers to strings name. orginally from Qualitas project
3911987_0_38_53.java,1,16,Compiere_330_Source/release_330/ad/src/org/compiere/translate/AmtInWords_FR.java,49,69,QS,known snippet to convert numbers to strings name. orginally from Qualitas project
4083418_0_1_28.java,1,28,apache-log4j-1.2.16/apache-log4j-1.2.16/src/main/java/org/apache/log4j/DailyRollingFileAppender.java,105,132,QS,question is about log4j. answer copies snippet to explain behaviour
598007_0_1_13.java,1,13,eclipse_SDK/eclipse_SDK-4.3/src/src/org/eclipse/jface/dialogs/ProgressMonitorDialog.java,252,264,QS,author of answer sayd he copied from Eclipse
6025026_0_212_233.java,1,22,jung2-2_0_1/jung-samples-2.0.1/edu/uci/ics/jung/samples/ShortestPathDemo.java,158,179,QS,answer says he copied this specific class and edited a bit to provide solution
6149818_0_1_20.java,1,20,spring-framework-3.0.5/spring-framework-3.0.5.RELEASE/projects/org.springframework.core/src/main/java/org/springframework/util/DefaultPropertiesPersister.java,67,86,QS,answer copies code from spring to explain behaviour
6722760_1_13_37.java,1,25,jgraph-latest-bsd-src/examples/org/jgraph/example/HelloWorld.java,14,37,QS,SO answer copies code from jgraph examples
7504040_0_5_17.java,1,13,eclipse_SDK/eclipse_SDK-4.3/src/src/junitsrc/org/junit/rules/ExternalResource.java,8,20,QS,authors says he copied form junit
7504040_0_5_17.java,1,13,junit-4/org/junit/rules/ExternalResource.java,8,20,QS,author asks a question says he copied from junit
801987_0_1_18.java,1,18,hadoop-1/hadoop-1.0.0/src/core/org/apache/hadoop/util/StringUtils.java,41,57,QS,answer says he copied from hadoop
8802082_2_1_20.java,1,20,junit-4/org/junit/internal/runners/statements/ExpectException.java,12,31,QS,author of answer says he copied code from JUnit
10042010_0_30_41.java,1,12,jung2-2_0_1/jung-algorithms-2.0.1/edu/uci/ics/jung/algorithms/layout/TreeLayout.java,85,96,QS,SO says he based on TreeLayout to answer question
10042010_0_42_55.java,1,14,jung2-2_0_1/jung-algorithms-2.0.1/edu/uci/ics/jung/algorithms/layout/TreeLayout.java,97,110,QS,SO says he based on TreeLayout to answer question
11187462_0_62_82.java,1,21,apache-log4j-1.2.16/apache-log4j-1.2.16/contribs/JimMoore/LoggingOutputStream.java,49,65,QS,SO says he copied from log4j
12427981_1_34_50.java,1,17,apache-log4j-1.2.16/apache-log4j-1.2.16/contribs/JimMoore/LoggingOutputStream.java,49,65,QS,"SO says the solution is copy and paste, and the whole class is too similar to the one in log4j for not being a clone."
12593810_0_1_12.java,1,12,poi-3.6-20091214/poi-3.6/src/ooxml/java/org/apache/poi/extractor/ExtractorFactory.java,49,60,QS,"question tags apache-poi. even error string is the same, very likely copy and paste"
12593810_0_1_12.java,1,12,poi-3.6-20091214/poi-3.6/src/ooxml/java/org/apache/poi/ss/usermodel/WorkbookFactory.java,18,29,QS,"question tags apache-poi. even error string is the same, very likely copy and paste"
12617195_0_7_20.java,1,14,apache-tomcat-7.0.2/apache-tomcat-7.0.2-src/java/org/apache/tomcat/util/http/fileupload/servlet/ServletFileUpload.java,12,25,QS,SO copies code from ServletFileUpload.java
12936580_0_47_62.java,1,16,jfreechart-1/jfreechart-1.0.13/source/org/jfree/chart/plot/XYPlot.java,1802,1820,QS,SO answer says he merged two classes from jfreechart to achieve solution
12936580_0_63_197.java,1,135,jfreechart-1/jfreechart-1.0.13/source/org/jfree/chart/renderer/category/AbstractCategoryItemRenderer.java,389,524,QS,SO answer says he merged two classes from jfreechart to achieve solution
13460384_0_1_12.java,1,12,spring-framework-3.0.5/spring-framework-3.0.5.RELEASE/projects/org.springframework.web.servlet/src/main/java/org/springframework/web/servlet/support/WebContentGenerator.java,99,110,QS,SO copies from spring to assist in reply
13592651_0_65_76.java,1,12,jung2-2_0_1/jung-algorithms-2.0.1/edu/uci/ics/jung/algorithms/layout/TreeLayout.java,85,96,QS,SO says he extended TreeLayout to achieve solution
13592651_0_77_90.java,1,14,jung2-2_0_1/jung-algorithms-2.0.1/edu/uci/ics/jung/algorithms/layout/TreeLayout.java,97,110,QS,SO says he extended TreeLayout to achieve solution
15131432_0_5_22.java,1,18,struts2-2.2.1-all/struts-2.2.1/src/core/src/main/java/org/apache/struts2/views/freemarker/FreemarkerManager.java,144,162,QS,SO is based on FreemarkerManager.java
15131432_0_23_42.java,1,20,struts2-2.2.1-all/struts-2.2.1/src/core/src/main/java/org/apache/struts2/views/freemarker/FreemarkerManager.java,163,177,QS,SO is based on FreemarkerManager.java
16207578_0_1_10.java,1,10,apache-tomcat-7.0.2/apache-tomcat-7.0.2-src/java/javax/servlet/http/HttpServlet.java,31,40,QS,SO posts code from HttpServlet to assist in reply
16207578_0_1_10.java,1,10,apache-tomcat-7.0.2/apache-tomcat-7.0.2-src/java/javax/servlet/http/HttpServlet.java,51,60,QS,SO posts code from HttpServlet to assist in reply. NOTE: consolidate these clones.
16207578_0_1_10.java,1,10,apache-tomcat-7.0.2/apache-tomcat-7.0.2-src/java/javax/servlet/http/HttpServlet.java,61,70,QS,SO posts code from HttpServlet to assist in reply. NOTE: consolidate these clones.
16207578_0_1_10.java,1,10,apache-tomcat-7.0.2/apache-tomcat-7.0.2-src/java/javax/servlet/http/HttpServlet.java,71,81,QS,SO posts code from HttpServlet to assist in reply. NOTE: consolidate these clones.
16860613_0_96_117.java,1,22,eclipse_SDK/eclipse_SDK-4.3/src/src/org/eclipse/jface/viewers/StyledString.java,96,117,QS,"although SO question was deleted, the snippet is the exact same class as the eclipse class"
16860613_0_118_165.java,1,48,eclipse_SDK/eclipse_SDK-4.3/src/src/org/eclipse/jface/viewers/StyledString.java,118,165,QS,"although SO question was deleted, the snippet is the exact same class as the eclipse class"
16860613_0_189_204.java,1,16,eclipse_SDK/eclipse_SDK-4.3/src/src/org/eclipse/jface/viewers/StyledString.java,189,204,QS,"although SO question was deleted, the snippet is the exact same class as the eclipse class"
16860613_0_215_225.java,1,11,eclipse_SDK/eclipse_SDK-4.3/src/src/org/eclipse/jface/viewers/StyledString.java,215,225,QS,"although SO question was deleted, the snippet is the exact same class as the eclipse class"
16928749_0_68_97.java,1,30,hadoop-1/hadoop-1.0.0/src/mapred/org/apache/hadoop/mapreduce/lib/output/TextOutputFormat.java,73,99,QS,SO question is about hadoop. The answer mentions TextOutputFormat in Hadoop. SO extends hadoop class to provide solution
16930707_0_22_37.java,1,16,hibernate-release-4/hibernate-release-4.2.2.Final/project/hibernate-envers/src/test/java/org/hibernate/envers/test/integration/basic/RegisterUserEventListenersTest.java,23,35,QS,SO copies from hibernate to assist reply
16930707_0_41_59.java,1,19,hibernate-release-4/hibernate-release-4.2.2.Final/project/hibernate-envers/src/test/java/org/hibernate/envers/test/integration/basic/RegisterUserEventListenersTest.java,40,53,QS,SO copies from hibernate to assist reply
17697173_0_1_19.java,1,19,lucene-4.3.0/lucene-4.3.0/analysis/common/src/java/org/apache/lucene/analysis/synonym/SlowSynonymFilterFactory.java,38,52,QS,SO copies from lucene to assist in reply
17994928_0_1_16.java,1,16,junit-4/org/junit/runners/ParentRunner.java,124,137,QS,SO copied from JUnit to assist in reply.
18647984_0_48_63.java,1,16,hadoop-1/hadoop-1.0.0/src/mapred/org/apache/hadoop/mapreduce/lib/input/SequenceFileRecordReader.java,36,50,QS,SO says he was based on haddop code to come up with solution
18687201_0_1_10.java,1,10,apache-tomcat-7.0.2/apache-tomcat-7.0.2-src/java/javax/servlet/http/HttpServlet.java,31,40,QS,original implementation of doPost in java servlet
18687201_0_1_10.java,1,10,apache-tomcat-7.0.2/apache-tomcat-7.0.2-src/java/javax/servlet/http/HttpServlet.java,61,70,QS,original implementation of java servelet doPost. Apache copied this code to its code base and cloned over several other methods
18687201_0_1_10.java,1,10,apache-tomcat-7.0.2/apache-tomcat-7.0.2-src/java/javax/servlet/http/HttpServlet.java,71,81,QS,original implementation of java servelet doPost. Apache copied this code to its code base and cloned over several other methods
18687201_0_1_10.java,1,10,eclipse_SDK/eclipse_SDK-4.3/src/src/javax/servlet/http/HttpServlet.java,32,41,QS,original implementation of java servelet doPost. Eclipse copied this code to its code base and cloned over several other methods
18687201_0_1_10.java,1,10,eclipse_SDK/eclipse_SDK-4.3/src/src/javax/servlet/http/HttpServlet.java,61,70,QS,original implementation of java servelet doPost. Eclipse copied this code to its code base and cloned over several other methods
18687201_0_1_10.java,1,10,eclipse_SDK/eclipse_SDK-4.3/src/src/javax/servlet/http/HttpServlet.java,71,81,QS,original implementation of java servelet doPost. Eclipse copied this code to its code base and cloned over several other methods
18970685_0_1_10.java,1,10,lucene-4.3.0/lucene-4.3.0/core/src/java/org/apache/lucene/store/FSDirectory.java,35,44,QS,SO copies from lucene to assist reply.
19567163_0_1_10.java,1,10,eclipse_SDK/eclipse_SDK-4.3/src/src/org/eclipse/ui/texteditor/AbstractDecoratedTextEditor.java,1351,1360,QS,SO says he copied code from the eclipse class to assist in reply
20470045_0_1_12.java,1,12,hibernate-release-4/hibernate-release-4.2.2.Final/project/documentation/src/main/docbook/devguide/en-US/chapters/events/extras/AuditInterceptor.java,16,32,QS,SO question mentions hibernate. same person who submit question later submitted right answer. he says he based on hibernate class to find solution
20470045_0_1_12.java,1,12,hibernate-release-4/hibernate-release-4.2.2.Final/project/documentation/src/main/docbook/devguide/en-US/chapters/events/extras/AuditInterceptor.java,43,58,QS,SO question mentions hibernate. same person who submit question later submitted right answer. he says he based on hibernate class to find solution
20470045_1_1_12.java,1,12,hibernate-release-4/hibernate-release-4.2.2.Final/project/documentation/src/main/docbook/devguide/en-US/chapters/events/extras/AuditInterceptor.java,16,32,QS,SO question mentions hibernate. same person who submit question later submitted right answer. he says he based on hibernate class to find solution
20470045_1_1_12.java,1,12,hibernate-release-4/hibernate-release-4.2.2.Final/project/documentation/src/main/docbook/devguide/en-US/chapters/events/extras/AuditInterceptor.java,43,58,QS,SO question mentions hibernate. same person who submit question later submitted right answer. he says he based on hibernate class to find solution
20913543_1_1_15.java,1,15,spring-framework-3.0.5/spring-framework-3.0.5.RELEASE/projects/org.springframework.beans/src/main/java/org/springframework/beans/factory/support/AutowireUtils.java,30,43,QS,SO posts code from spring to assist in reply
20957626_0_1_15.java,1,15,lucene-4.3.0/lucene-4.3.0/core/src/java/org/apache/lucene/search/FieldValueHitQueue.java,49,60,QS,SO claims the code is from hibernate. Qualitas snippet is from lucene. SO answer says the code is from Hibernate-Search sourcecode which is actually from lucene.
22315734_0_10_21.java,1,12,hadoop-1/hadoop-1.0.0/src/core/org/apache/hadoop/io/serializer/DeserializerComparator.java,16,26,QS,SO posts code from hadoop to assist in reply
22315734_0_10_21.java,1,12,hadoop-1/hadoop-1.0.0/src/core/org/apache/hadoop/io/WritableComparator.java,44,54,QS,SO posts code from hadoop to assist in reply
22692838_1_1_16.java,1,16,lucene-4.3.0/lucene-4.3.0/queryparser/src/java/org/apache/lucene/queryparser/classic/QueryParserBase.java,668,680,QS,SO says he based on lucene code to reach solution (from Apache Solr's ClientUtils.escapeQueryChars()).
22692838_1_1_16.java,1,16,lucene-4.3.0/lucene-4.3.0/queryparser/src/java/org/apache/lucene/queryparser/flexible/standard/QueryParserUtil.java,59,72,QS,SO says he based on lucene code to reach solution (from Apache Solr's ClientUtils.escapeQueryChars()).
24330611_0_180_193.java,1,14,jung2-2_0_1/jung-samples-2.0.1/edu/uci/ics/jung/samples/TreeCollapseDemo.java,127,138,QS,SO question is about jung. SO answer says he writes solution based on jung code
24330611_0_197_213.java,1,17,jung2-2_0_1/jung-samples-2.0.1/edu/uci/ics/jung/samples/TreeCollapseDemo.java,142,157,QS,SO question is about jung. SO answer says he writes solution based on jung code
24330611_0_256_269.java,1,14,jung2-2_0_1/jung-samples-2.0.1/edu/uci/ics/jung/samples/L2RTreeLayoutDemo.java,170,181,QS,SO question is about jung. SO answer says he writes solution based on jung code
24330611_0_256_269.java,1,14,jung2-2_0_1/jung-samples-2.0.1/edu/uci/ics/jung/samples/RadialTreeLensDemo.java,199,211,QS,SO question is about jung. SO answer says he writes solution based on jung code
24330611_0_256_269.java,1,14,jung2-2_0_1/jung-samples-2.0.1/edu/uci/ics/jung/samples/TreeCollapseDemo.java,199,211,QS,SO question is about jung. SO answer says he writes solution based on jung code
24330611_0_256_269.java,1,14,jung2-2_0_1/jung-samples-2.0.1/edu/uci/ics/jung/samples/TreeLayoutDemo.java,161,172,QS,SO question is about jung. SO answer says he writes solution based on jung code
24330611_0_320_333.java,1,14,jung2-2_0_1/jung-samples-2.0.1/edu/uci/ics/jung/samples/VertexCollapseDemoWithLayouts.java,247,258,QS,SO question is about jung. SO answer says he writes solution based on jung code
249149_0_1_11.java,1,11,spring-framework-3.0.5/spring-framework-3.0.5.RELEASE/projects/org.springframework.transaction/src/main/java/org/springframework/jca/cci/core/CciTemplate.java,193,203,QS,SO posts code from springer to assist in reply
2513183_0_96_105.java,1,10,eclipse_SDK/eclipse_SDK-4.3/src/src/org/eclipse/jdt/ui/actions/GenerateToStringAction.java,102,111,QS,SO posts the exact same Eclipse class to assist in reply
2513183_0_168_181.java,1,14,eclipse_SDK/eclipse_SDK-4.3/src/src/org/eclipse/jdt/ui/actions/GenerateToStringAction.java,175,188,QS,SO posts the exact same Eclipse class to assist in reply
25651812_0_43_83.java,1,41,jfreechart-1/jfreechart-1.0.13/source/org/jfree/chart/demo/BarChartDemo1.java,56,87,QS,SO copies the exact same example as in the jfreechart code base
25719073_2_1_10.java,1,10,eclipse_SDK/eclipse_SDK-4.3/src/src/org/eclipse/swt/widgets/Composite.java,481,490,QS,SO copies code from eclipse swt to assist in reply
25775172_0_26_35.java,1,10,jfreechart-1/jfreechart-1.0.13/source/org/jfree/chart/demo/BarChartDemo1.java,19,28,QS,SO copies code from jfreechart to assist in reply
6025026_0_47_93.java,1,47,jung2-2_0_1/jung-samples-2.0.1/edu/uci/ics/jung/samples/ShortestPathDemo.java,42,82,QS,SO says he copied code from jung example to find solution
6025026_0_70_88.java,1,19,jung2-2_0_1/jung-samples-2.0.1/edu/uci/ics/jung/samples/ShortestPathDemo.java,58,77,QS,SO says he copied code from jung example to find solution
6025026_0_105_114.java,1,10,jung2-2_0_1/jung-samples-2.0.1/edu/uci/ics/jung/samples/ShortestPathDemo.java,90,99,QS,SO says he copied code from jung example to find solution
6025026_0_119_128.java,1,10,jung2-2_0_1/jung-samples-2.0.1/edu/uci/ics/jung/samples/ShortestPathDemo.java,104,113,QS,SO says he copied code from jung example to find solution
6025026_0_137_153.java,1,17,jung2-2_0_1/jung-samples-2.0.1/edu/uci/ics/jung/samples/ShortestPathDemo.java,121,137,QS,SO says he copied code from jung example to find solution
6025026_0_221_230.java,1,10,jung2-2_0_1/jung-samples-2.0.1/edu/uci/ics/jung/samples/ShortestPathDemo.java,167,176,QS,SO says he copied code from jung example to find solution
6092014_0_1_10.java,1,10,eclipse_SDK/eclipse_SDK-4.3/src/src/org/eclipse/ui/internal/registry/ViewParameterValues.java,8,17,QS,SO posts code from eclipse to assist in reply
609430_0_1_17.java,1,17,hibernate-release-4/hibernate-release-4.2.2.Final/project/hibernate-core/src/main/java/org/hibernate/event/internal/DefaultLoadEventListener.java,277,293,QS,SO copies code from hibernate to assist in reply
6722760_1_38_56.java,1,19,jgraph-latest-bsd-src/examples/com/jgraph/example/mycellview/MyCellView.java,53,73,QS,SO says he copied and modified code from jgraph to provide solution
6722760_1_38_56.java,1,19,jgraph-latest-bsd-src/examples/org/jgraph/example/GroupingRemoving.java,52,70,QS,SO says he copied and modified code from jgraph to provide solution
6722760_1_38_56.java,1,19,jgraph-latest-bsd-src/examples/org/jgraph/example/HelloWorld.java,38,56,QS,SO says he copied and modified code from jgraph to provide solution
7099864_1_13_27.java,1,15,spring-framework-3.0.5/spring-framework-3.0.5.RELEASE/projects/org.springframework.web.servlet/src/main/java/org/springframework/web/servlet/tags/form/OptionTag.java,84,98,QS,SO question is about spring. SO answer provides solution class that is similar to the one in spring not only in the method that is reported as clones but also other 3 methods in the rest of the class.
8065120_1_1_11.java,1,11,eclipse_SDK/eclipse_SDK-4.3/src/src/org/eclipse/ui/forms/widgets/FormToolkit.java,287,297,QS,SO copies code from eclipse to assist in reply
8584917_0_1_12.java,1,12,poi-3.6-20091214/poi-3.6/src/ooxml/java/org/apache/poi/xssf/usermodel/XSSFCell.java,229,240,QS,SO posts code from apache POI to assist in reply
9003314_0_70_83.java,1,14,spring-framework-3.0.5/spring-framework-3.0.5.RELEASE/projects/org.springframework.web/src/main/java/org/springframework/web/bind/WebDataBinder.java,95,108,QS,SO solution says the cloned method is copied from WebDataBinder
968656_1_1_11.java,1,11,eclipse_SDK/eclipse_SDK-4.3/src/src/org/eclipse/jdt/internal/junit/wizards/MethodStubsSelectionButtonGroup.java,207,217,QS,SO posts code from eclipse to assist in reply
968656_1_1_11.java,1,11,eclipse_SDK/eclipse_SDK-4.3/src/src/org/eclipse/jdt/internal/ui/wizards/dialogfields/DialogField.java,36,46,QS,SO posts code from eclipse to assist in reply
10274267_0_1_12.java,1,12,hibernate-release-4/hibernate-release-4.2.2.Final/project/documentation/src/main/docbook/devguide/en-US/extras/flush_and_clear_session.java,1,12,QS,answer posts code from hibernate to explain
10289462_0_1_45.java,1,45,apache-tomcat-7.0.2/apache-tomcat-7.0.2-src/java/org/apache/jasper/runtime/JspRuntimeLibrary.java,252,296,QS,answer posts code from tomcat to explain
10737817_0_1_13.java,1,13,hibernate-release-4/hibernate-release-4.2.2.Final/project/hibernate-entitymanager/src/main/java/org/hibernate/ejb/criteria/QueryStructure.java,78,90,QS,SO copies code from hibernate to assist answer
10774468_0_10_69.java,1,60,weka-3-7-9/main/java/weka/core/NormalizableDistance.java,145,204,QS,SO copies code from weka to assist answer
10774468_0_42_59.java,1,18,weka-3-7-9/main/java/weka/attributeSelection/ReliefFAttributeEval.java,443,460,QS,SO copies code from weka to assist answer
